{
  "display": {
    "icon": {
      "item": "minecraft:writable_book"
    },
    "title": "advancement.entomology.master_entomologist.title",
    "description": "advancement.entomology.master_entomologist.description",
    "frame": "challenge",
    "show_toast": true,
    "announce_to_chat": true,
    "hidden": false
  },
  "parent": "entomology:all_species",
  "criteria": {
    "complete_encyclopedia": {
      "trigger": "minecraft:impossible"
    }
  },
  "rewards": {
    "experience": 500
  }
}
